{
  "$schema": "https://json-schema.org/draft/2020-12/schema",
  "$id": "https://yukh.example/schemas/capability/v1/request.schema.json",
  "type": "object",
  "additionalProperties": false,
  "required": ["request_version", "request_id", "capability", "resource", "environment", "input"],
  "properties": {
    "request_version": { "const": 1 },
    "request_id": { "$ref": "https://yukh.example/schemas/capability/v1/common.schema.json#/$defs/opaqueId" },
    "capability": { "$ref": "https://yukh.example/schemas/capability/v1/common.schema.json#/$defs/capabilityRef" },
    "resource": {
      "oneOf": [
        {
          "type": "object", "additionalProperties": false, "required": ["kind", "ref"],
          "properties": {
            "kind": { "type": "string", "pattern": "^[a-z][a-z0-9._-]{0,63}$", "maxLength": 64 },
            "ref": { "$ref": "https://yukh.example/schemas/capability/v1/common.schema.json#/$defs/resourceRef" }
          }
        },
        {
          "type": "object", "additionalProperties": false, "required": ["kind", "refs"],
          "properties": {
            "kind": { "type": "string", "pattern": "^[a-z][a-z0-9._-]{0,63}$", "maxLength": 64 },
            "refs": {
              "type": "array", "minItems": 1, "maxItems": 1000, "uniqueItems": true,
              "items": { "$ref": "https://yukh.example/schemas/capability/v1/common.schema.json#/$defs/resourceRef" }
            }
          }
        }
      ]
    },
    "environment": { "$ref": "https://yukh.example/schemas/capability/v1/common.schema.json#/$defs/environment" },
    "input": { "type": "object", "maxProperties": 128 },
    "idempotency_key": {
      "type": ["string", "null"], "pattern": "^[A-Za-z0-9._:-]{8,128}$", "maxLength": 128
    }
  }
}
